{
  "id": "IR-SCP-002",
  "revision": 1,
  "dimension": "scope",
  "engine": "hybrid",
  "messageKey": "rules.scope.independent-delivery-goals",
  "appliesTo": [
    "generic",
    "bug",
    "feature",
    "docs",
    "dependency",
    "refactor",
    "test-ci",
    "operations"
  ],
  "canonicalLevel": "mandatory",
  "evidenceSources": [
    "markdown-ast:independent-goals",
    "native-relationships:independent-children",
    "semantic-criterion:separable-goals"
  ],
  "aggregation": {
    "operator": "hard-facts-first-then-semantic-coverage",
    "sourcePriority": [
      "markdown-ast",
      "native-relationships",
      "semantic-criterion"
    ],
    "conflict": "preserve-all-evidence-hard-facts-win-otherwise-unknown",
    "unknown": "propagate-when-no-complete-source-proves-outcome",
    "notApplicable": "only-registered-task-pack-may-declare",
    "possibleOutcomes": ["PASS", "FAIL", "UNKNOWN", "NOT_APPLICABLE"]
  },
  "hardPredicate": {
    "kind": "independent-goals-with-separate-acceptance",
    "allowedSources": ["markdown-ast", "native-relationships"]
  },
  "onFail": {
    "evaluationEffect": "NONE",
    "specEffect": "TOO_BROAD",
    "dispositionEffect": "NONE"
  },
  "onUnknown": {
    "evaluationEffect": "DEGRADED",
    "specEffect": "NULL_IF_OUTCOME_COULD_CHANGE",
    "dispositionEffect": "NONE"
  }
}
