{
  "id": "IR-VAL-001",
  "revision": 1,
  "dimension": "validation",
  "engine": "hybrid",
  "messageKey": "rules.validation.applicable-validation",
  "appliesTo": [
    "generic",
    "bug",
    "feature",
    "docs",
    "dependency",
    "refactor",
    "test-ci",
    "operations"
  ],
  "canonicalLevel": "conditional",
  "evidenceSources": [
    "issue-form-field:validation",
    "markdown-ast:validation-candidate",
    "semantic-criterion:applicable-validation"
  ],
  "aggregation": {
    "operator": "hard-facts-first-then-semantic-coverage",
    "sourcePriority": [
      "issue-form-field",
      "markdown-ast",
      "semantic-criterion"
    ],
    "conflict": "preserve-all-evidence-hard-facts-win-otherwise-unknown",
    "unknown": "propagate-when-no-complete-source-proves-outcome",
    "notApplicable": "only-registered-task-pack-may-declare",
    "possibleOutcomes": ["PASS", "FAIL", "UNKNOWN", "NOT_APPLICABLE"]
  },
  "hardPredicate": "none",
  "onFail": {
    "evaluationEffect": "NONE",
    "specEffect": "NEEDS_INFO",
    "dispositionEffect": "NONE"
  },
  "onUnknown": {
    "evaluationEffect": "DEGRADED",
    "specEffect": "NULL_IF_OUTCOME_COULD_CHANGE",
    "dispositionEffect": "NONE"
  }
}
