{
  "id": "IR-FRESH-001",
  "revision": 1,
  "dimension": "freshness",
  "engine": "deterministic+semantic",
  "messageKey": "rules.freshness.current-dependency-state",
  "appliesTo": [
    "generic",
    "bug",
    "feature",
    "docs",
    "dependency",
    "refactor",
    "test-ci",
    "operations"
  ],
  "canonicalLevel": "conditional",
  "evidenceSources": [
    "native-relationships:state",
    "github-reference:state",
    "semantic-criterion:version-freshness"
  ],
  "aggregation": {
    "operator": "hard-facts-first-then-semantic-coverage",
    "sourcePriority": [
      "native-relationships",
      "github-reference",
      "semantic-criterion"
    ],
    "conflict": "preserve-all-evidence-hard-facts-win-otherwise-unknown",
    "unknown": "propagate-when-no-complete-source-proves-outcome",
    "notApplicable": "only-registered-task-pack-may-declare",
    "possibleOutcomes": ["PASS", "FAIL", "UNKNOWN", "NOT_APPLICABLE"]
  },
  "hardPredicate": "none",
  "onFail": {
    "evaluationEffect": "NONE",
    "specEffect": "NEEDS_INFO",
    "dispositionEffect": "NONE"
  },
  "onUnknown": {
    "evaluationEffect": "DEGRADED",
    "specEffect": "NULL_IF_OUTCOME_COULD_CHANGE",
    "dispositionEffect": "NONE"
  }
}
