{
  "id": "IR-ACC-001",
  "revision": 1,
  "dimension": "acceptance",
  "engine": "deterministic+semantic",
  "messageKey": "rules.acceptance.observable-completion",
  "appliesTo": [
    "generic",
    "bug",
    "feature",
    "docs",
    "dependency",
    "refactor",
    "test-ci",
    "operations"
  ],
  "canonicalLevel": "mandatory",
  "evidenceSources": [
    "issue-form-field:acceptance",
    "markdown-ast:acceptance-candidate",
    "semantic-criterion:observable-acceptance"
  ],
  "aggregation": {
    "operator": "hard-facts-first-then-semantic-coverage",
    "sourcePriority": [
      "issue-form-field",
      "markdown-ast",
      "semantic-criterion"
    ],
    "conflict": "preserve-all-evidence-hard-facts-win-otherwise-unknown",
    "unknown": "propagate-when-no-complete-source-proves-outcome",
    "notApplicable": "only-registered-task-pack-may-declare",
    "possibleOutcomes": ["PASS", "FAIL", "UNKNOWN", "NOT_APPLICABLE"]
  },
  "hardPredicate": {
    "kind": "required-field-provably-empty",
    "allowedSources": ["issue-form-field"]
  },
  "onFail": {
    "evaluationEffect": "NONE",
    "specEffect": "NEEDS_INFO",
    "dispositionEffect": "NONE"
  },
  "onUnknown": {
    "evaluationEffect": "DEGRADED",
    "specEffect": "NULL_IF_OUTCOME_COULD_CHANGE",
    "dispositionEffect": "NONE"
  }
}
