{
  "id": "IR-DEF-001",
  "revision": 1,
  "dimension": "definition",
  "engine": "deterministic+semantic",
  "messageKey": "rules.definition.concrete-object-action",
  "appliesTo": [
    "generic",
    "bug",
    "feature",
    "docs",
    "dependency",
    "refactor",
    "test-ci",
    "operations"
  ],
  "canonicalLevel": "mandatory",
  "evidenceSources": [
    "issue-title:object-action",
    "issue-body:object-action",
    "semantic-criterion:concrete-work"
  ],
  "aggregation": {
    "operator": "hard-facts-first-then-semantic-coverage",
    "sourcePriority": ["issue-title", "issue-body", "semantic-criterion"],
    "conflict": "preserve-all-evidence-hard-facts-win-otherwise-unknown",
    "unknown": "propagate-when-no-complete-source-proves-outcome",
    "notApplicable": "only-registered-task-pack-may-declare",
    "possibleOutcomes": ["PASS", "FAIL", "UNKNOWN", "NOT_APPLICABLE"]
  },
  "hardPredicate": {
    "kind": "title-or-body-provably-empty",
    "allowedSources": ["issue-title", "issue-body"]
  },
  "onFail": {
    "evaluationEffect": "NONE",
    "specEffect": "NEEDS_INFO",
    "dispositionEffect": "NONE"
  },
  "onUnknown": {
    "evaluationEffect": "DEGRADED",
    "specEffect": "NULL_IF_OUTCOME_COULD_CHANGE",
    "dispositionEffect": "NONE"
  }
}
