{
  "id": "IR-EDG-001",
  "revision": 1,
  "dimension": "behavior",
  "engine": "semantic",
  "messageKey": "rules.behavior.critical-edge-behavior",
  "appliesTo": ["bug", "feature"],
  "canonicalLevel": "conditional",
  "evidenceSources": ["semantic-criterion:critical-edge-behavior"],
  "aggregation": {
    "operator": "semantic-criterion",
    "sourcePriority": ["semantic-criterion"],
    "conflict": "preserve-all-evidence-hard-facts-win-otherwise-unknown",
    "unknown": "propagate-when-no-complete-source-proves-outcome",
    "notApplicable": "only-registered-task-pack-may-declare",
    "possibleOutcomes": ["PASS", "FAIL", "UNKNOWN", "NOT_APPLICABLE"]
  },
  "hardPredicate": "none",
  "onFail": {
    "evaluationEffect": "NONE",
    "specEffect": "NEEDS_INFO",
    "dispositionEffect": "NONE"
  },
  "onUnknown": {
    "evaluationEffect": "DEGRADED",
    "specEffect": "NULL_IF_OUTCOME_COULD_CHANGE",
    "dispositionEffect": "NONE"
  }
}
